Date,Injury,Firstname,Lastname,City,TeamName
"Oct 20, 2017",Missed 7 games (back injury).,BOONE,JENNER,COLUMBUS,BLUEJACKETS
"Oct 03, 2017","Back injury, injured reserve.",BOONE,JENNER,COLUMBUS,BLUEJACKETS
"Feb 29, 2016",Signed by the Columbus Blue Jackets to a two-year contract extension.,BOONE,JENNER,COLUMBUS,BLUEJACKETS
"Mar 20, 2015",Missed 40 games (back injury).,BOONE,JENNER,COLUMBUS,BLUEJACKETS
"Dec 20, 2014","Back injury, injured reserve.",BOONE,JENNER,COLUMBUS,BLUEJACKETS
"Nov 03, 2014",Missed 11 games (broken left hand).,BOONE,JENNER,COLUMBUS,BLUEJACKETS
"Oct 05, 2014","Broken left hand, injured reserve.",BOONE,JENNER,COLUMBUS,BLUEJACKETS
"Nov 17, 2013",Missed 9 games (leg injury).,BOONE,JENNER,COLUMBUS,BLUEJACKETS
"Oct 26, 2013","Leg injury, sidelined indefinitely.",BOONE,JENNER,COLUMBUS,BLUEJACKETS
"Apr 11, 2013",Re-assigned to Springfield (AHL).,BOONE,JENNER,COLUMBUS,BLUEJACKETS
"Jan 17, 2013",Assigned to Oshawa (OHL).,BOONE,JENNER,COLUMBUS,BLUEJACKETS
"Jan 10, 2013",Recalled from Oshawa (OHL).,BOONE,JENNER,COLUMBUS,BLUEJACKETS
"Sep 13, 2012",Returned to his junior team (Oshawa-OHL).,BOONE,JENNER,COLUMBUS,BLUEJACKETS
"Mar 28, 2012",Signed by the Columbus Blue Jackets to a three-year entry-level contract.,BOONE,JENNER,COLUMBUS,BLUEJACKETS
"Sep 21, 2011",Returned to his junior team (Oshawa-OHL).,BOONE,JENNER,COLUMBUS,BLUEJACKETS
