Date,Injury,Firstname,Lastname,City,TeamName
"Feb 19, 2018",Acquired from the Chicago Blackhawks.,MICHAL,KEMPNY,WASHINGTON,CAPITALS
"Nov 25, 2017",Missed 1 game (illness).,MICHAL,KEMPNY,WASHINGTON,CAPITALS
"Nov 22, 2017","Illness, day-to-day.",MICHAL,KEMPNY,WASHINGTON,CAPITALS
"May 27, 2017",Signed by the Chicago Blackhawks to a one-year contract extension.,MICHAL,KEMPNY,WASHINGTON,CAPITALS
"May 24, 2016",Signed as an undrafted free agent by the Chicago Blackhawks to a one-year entry-level contract.,MICHAL,KEMPNY,WASHINGTON,CAPITALS
